,id,conversation_id,created_at,date,tweet,language,hashtags,user_id,username,name,link,urls,nlikes,nreplies,nretweets,search,new_tweet,neg,neu,pos,compound,time
85,698238905120923648,698238905120923648,1455308102000.0,2016-02-12,Even the UK government agrees #SnoopersCharter is a threat to rights. What it is:  https://t.co/CUm4OIlP5K #IPbill  https://t.co/0DbWw9nxRB,en,"['snooperscharter', 'ipbill']",2916305152,Snowden,Edward Snowden,https://twitter.com/Snowden/status/698238905120923648,['http://www.mirror.co.uk/news/uk-news/even-theresa-doesnt-understand-snoopers-7174086'],707,32,749,"UK (Labour OR Conservative OR Parliament OR Government OR ""Lib OR dems"" OR ""liberal OR democrats"")",Even the UK government agrees #SnoopersCharter is a threat to rights. What it is:  https://t.co/CUm4OIlP5K #IPbill  https://t.co/0DbWw9nxRB,0.168,0.743,0.089,-0.3818,20:15:02
86,705458999353860098,705458999353860098,1457029506000.0,2016-03-03,UK Government officially scared of clowns  https://t.co/YFMBgdkjNb,en,[],19394186,charltonbrooker,Charlie Brooker,https://twitter.com/charltonbrooker/status/705458999353860098,['http://www.telegraph.co.uk/culture/culturenews/12182297/Chris-Grayling-Satirical-television-programmes-should-not-be-allowed-to-use-footage-of-inside-parliament.html'],521,79,648,"UK (Labour OR Conservative OR Parliament OR Government OR ""Lib OR dems"" OR ""liberal OR democrats"")",UK Government officially scared of clowns  https://t.co/YFMBgdkjNb,0.326,0.674,0.0,-0.4404,18:25:06
87,705369781092782080,705369781092782080,1457008235000.0,2016-03-03,UK Brexit campaign gathers force as government makes obviously false claims aimed at scaring voters. Early days yet.,en,[],451586190,rupertmurdoch,Rupert Murdoch,https://twitter.com/rupertmurdoch/status/705369781092782080,[],414,325,344,"UK (Labour OR Conservative OR Parliament OR Government OR ""Lib OR dems"" OR ""liberal OR democrats"")",UK Brexit campaign gathers force as government makes obviously false claims aimed at scaring voters. Early days yet.,0.146,0.854,0.0,-0.4404,12:30:35
88,706572270182010880,706572270182010880,1457294931000.0,2016-03-06,"Labour MP Chuka Umunna:""Nestlé's HQ is based in the UK because we're in the EU""  It's actually in Switzerland... outside the EU...ouch",en,[],906787915,adamlillico_,adam,https://twitter.com/adamlillico_/status/706572270182010880,[],274,57,377,"UK (Labour OR Conservative OR Parliament OR Government OR ""Lib OR dems"" OR ""liberal OR democrats"")","Labour MP Chuka Umunna:""Nestlé's HQ is based in the UK because we're in the EU""  It's actually in Switzerland... outside the EU...ouch",0.0,1.0,0.0,0.0,20:08:51
89,706895536465424384,706895536465424384,1457372004000.0,2016-03-07,Good luck @hollidayjoe and @elaxora leading protests today outside Parliament for UK gov to announce Intersex Equality Inquiry,en,[],178812809,IAMLenaHeadey,lena headey,https://twitter.com/IAMLenaHeadey/status/706895536465424384,[],276,11,44,"UK (Labour OR Conservative OR Parliament OR Government OR ""Lib OR dems"" OR ""liberal OR democrats"")",Good luck @hollidayjoe and @elaxora leading protests today outside Parliament for UK gov to announce Intersex Equality Inquiry,0.083,0.658,0.259,0.6124,17:33:24
90,710941159460347905,710941159460347905,1458336555000.0,2016-03-18,"IDS now free to campaign freely for UK to leave EU and hope for swift return in a Boris government as his reward. Cynical, moi?",en,[],169864622,MaryCreagh_,Mary Creagh CBE,https://twitter.com/MaryCreagh_/status/710941159460347905,[],125,19,170,"UK (Labour OR Conservative OR Parliament OR Government OR ""Lib OR dems"" OR ""liberal OR democrats"")","IDS now free to campaign freely for UK to leave EU and hope for swift return in a Boris government as his reward. Cynical, moi?",0.104,0.495,0.401,0.8957,21:29:15
91,710857146217455616,710857146217455616,1458316525000.0,2016-03-18,"As Government moves to make tampons 0% tax rateable, Google announces new UK HQ.  https://t.co/AMaqnl00xx",en,[],125370749,haveigotnews,Have I Got News For You,https://twitter.com/haveigotnews/status/710857146217455616,[],647,8,587,"UK (Labour OR Conservative OR Parliament OR Government OR ""Lib OR dems"" OR ""liberal OR democrats"")","As Government moves to make tampons 0% tax rateable, Google announces new UK HQ.  https://t.co/AMaqnl00xx",0.0,1.0,0.0,0.0,15:55:25
92,715645120155164672,715645120155164672,1459458067000.0,2016-03-31,Government not just standing idly by as steel crisis unfolds but actively working against UK steel. Despicable.  https://t.co/NYWOZo4ITf,en,[],143508762,LouHaigh,Louise Haigh,https://twitter.com/LouHaigh/status/715645120155164672,[],341,52,752,"UK (Labour OR Conservative OR Parliament OR Government OR ""Lib OR dems"" OR ""liberal OR democrats"")",Government not just standing idly by as steel crisis unfolds but actively working against UK steel. Despicable.  https://t.co/NYWOZo4ITf,0.119,0.744,0.137,0.1027,22:01:07
93,715463838762737664,715463838762737664,1459414846000.0,2016-03-31,"So in opposing higher EU tariffs on Chinese steel, our government was helping Tata's UK cars business while killing its steel. Messy",en,[],14157134,Peston,Robert Peston,https://twitter.com/Peston/status/715463838762737664,[],199,30,408,"UK (Labour OR Conservative OR Parliament OR Government OR ""Lib OR dems"" OR ""liberal OR democrats"")","So in opposing higher EU tariffs on Chinese steel, our government was helping Tata's UK cars business while killing its steel. Messy",0.246,0.676,0.078,-0.6908,10:00:46
94,715459800256159744,715459800256159744,1459413883000.0,2016-03-31,TATA spells shambles at heart of Government: No Ministers speaking &amp; the PM off to DC: + no word on why UK veto'd tariffs on China steel,en,[],128216887,jonsnowC4,Jon Snow,https://twitter.com/jonsnowC4/status/715459800256159744,[],280,38,544,"UK (Labour OR Conservative OR Parliament OR Government OR ""Lib OR dems"" OR ""liberal OR democrats"")",TATA spells shambles at heart of Government: No Ministers speaking &amp; the PM off to DC: + no word on why UK veto'd tariffs on China steel,0.135,0.736,0.129,0.2023,09:44:43
