,id,conversation_id,created_at,date,tweet,language,hashtags,user_id,username,name,link,urls,nlikes,nreplies,nretweets,search,new_tweet,neg,neu,pos,compound,time
639,948533832239730689,948533832239730689,1514983063000.0,2018-01-03,"""Thatcher built more houses in one year than Labour built in their 13 years of government.""  Conservative London Assembly Member @ShaunBaileyUK claims there's a desperate housing shortage across the board in the UK.  https://t.co/q5qnZLSBEg",en,[],14569869,Channel4News,Channel 4 News,https://twitter.com/Channel4News/status/948533832239730689,[],194,73,134,"UK (Labour OR Conservative OR Parliament OR Government OR ""Lib OR dems"" OR ""liberal OR democrats"")","""Thatcher built more houses in one year than Labour built in their 13 years of government.""  Conservative London Assembly Member @ShaunBaileyUK claims there's a desperate housing shortage across the board in the UK.  https://t.co/q5qnZLSBEg",0.118,0.882,0.0,-0.5106,12:37:43
640,948522328652103680,948522328652103680,1514980320000.0,2018-01-03,"DEFRA reveals vast majority of 60,000 responses to the UK Government's plan to ban ivory  sales are in favour of the prohibition. As we await the outcome, we wanted to say #thankyou to everyone that sent a response:  https://t.co/Hi4ZS847Bh",en,['thankyou'],40079154,SheldrickTrust,Sheldrick Wildlife Trust,https://twitter.com/SheldrickTrust/status/948522328652103680,['http://www.telegraph.co.uk/news/2018/01/01/vast-majority-public-backs-ban-ivory-sales/'],382,0,112,"UK (Labour OR Conservative OR Parliament OR Government OR ""Lib OR dems"" OR ""liberal OR democrats"")","DEFRA reveals vast majority of 60,000 responses to the UK Government's plan to ban ivory  sales are in favour of the prohibition. As we await the outcome, we wanted to say #thankyou to everyone that sent a response:  https://t.co/Hi4ZS847Bh",0.082,0.82,0.098,-0.0772,11:52:00
641,948478839147163649,948478839147163649,1514969951000.0,2018-01-03,"Another reason why we need a new government in the UK: without it, London will remain an entrepot for organised crime and money-laundering. Result: gangster capitalism and dark money networks will gradually strangle democracy. #McMafia",en,['mcmafia'],198584761,GeorgeMonbiot,George Monbiot,https://twitter.com/GeorgeMonbiot/status/948478839147163649,[],158,7,61,"UK (Labour OR Conservative OR Parliament OR Government OR ""Lib OR dems"" OR ""liberal OR democrats"")","Another reason why we need a new government in the UK: without it, London will remain an entrepot for organised crime and money-laundering. Result: gangster capitalism and dark money networks will gradually strangle democracy. #McMafia",0.093,0.907,0.0,-0.5423,08:59:11
642,948470705083113472,948470705083113472,1514968012000.0,2018-01-03,"It is not normal to cancel all UK operations nationally - not in a developing country, not even in a war-torn country. Why does your analysis not shift the blame to the government cuts?  ""Elderly people at risk of dying"" reported on BBC #NHSCrisis  https://t.co/0S5v6dxh7m",en,['nhscrisis'],61481674,Jane_Samuels,Jane Samuels,https://twitter.com/Jane_Samuels/status/948470705083113472,['https://twitter.com/ChrisCEOHopson/status/948286373135572994'],137,10,120,"UK (Labour OR Conservative OR Parliament OR Government OR ""Lib OR dems"" OR ""liberal OR democrats"")","It is not normal to cancel all UK operations nationally - not in a developing country, not even in a war-torn country. Why does your analysis not shift the blame to the government cuts?  ""Elderly people at risk of dying"" reported on BBC #NHSCrisis  https://t.co/0S5v6dxh7m",0.088,0.835,0.077,-0.1341,08:26:52
643,949393004032389121,949393004032389121,1515187905000.0,2018-01-05,Is Toby Young a fit person to be the UK government's new University Regulator?,en,[],1657761703,MarieAnnUK,Marie-Ann Detests Tories 🇺🇦 🇪🇺 🇬🇧,https://twitter.com/MarieAnnUK/status/949393004032389121,[],174,55,598,"UK (Labour OR Conservative OR Parliament OR Government OR ""Lib OR dems"" OR ""liberal OR democrats"")",Is Toby Young a fit person to be the UK government's new University Regulator?,0.0,0.839,0.161,0.3612,21:31:45
644,949361077480931328,949361077480931328,1515180293000.0,2018-01-05,"PTC News coverage of my visit to the UK Parliament where my family &amp; I joined Hon’ble MP @TanDhesi in kicking off the 550-year celebrations of the advent of the 1st Sikh Master, Guru Nanak Sahib from the portals of the British @HouseofCommons! #LoveGreatBritain @VisitBritain 🇬🇧  https://t.co/X82HszR5yZ",en,['lovegreatbritain'],15210670,SinghLions,Harjinder Singh Kukreja,https://twitter.com/SinghLions/status/949361077480931328,[],334,12,57,"UK (Labour OR Conservative OR Parliament OR Government OR ""Lib OR dems"" OR ""liberal OR democrats"")","PTC News coverage of my visit to the UK Parliament where my family &amp; I joined Hon’ble MP @TanDhesi in kicking off the 550-year celebrations of the advent of the 1st Sikh Master, Guru Nanak Sahib from the portals of the British @HouseofCommons! #LoveGreatBritain @VisitBritain 🇬🇧  https://t.co/X82HszR5yZ",0.0,1.0,0.0,0.0,19:24:53
645,949323957865472005,949323957865472005,1515171443000.0,2018-01-05,"UK National Health Service, is one of the best in the world . We should be very proud and not allow any of it to be sold to private investors who put profit before patient. Conservative record on the NHS is beyond terrible . They damaging our good service.",en,[],2372092065,Muqadaam,Nadeem Ahmed,https://twitter.com/Muqadaam/status/949323957865472005,[],197,12,134,"UK (Labour OR Conservative OR Parliament OR Government OR ""Lib OR dems"" OR ""liberal OR democrats"")","UK National Health Service, is one of the best in the world . We should be very proud and not allow any of it to be sold to private investors who put profit before patient. Conservative record on the NHS is beyond terrible . They damaging our good service.",0.127,0.662,0.211,0.7451,16:57:23
646,949318578569994240,949318578569994240,1515170161000.0,2018-01-05,May and Hunt dine out on the notion that NHS spending has increased year on year under them  But the same could be said of any UK government since the dawn of time  This shows the real truth about NHS spending under this government - pls RT if you think everyone should be aware  https://t.co/CZOFT31u9B,en,[],4882743003,NHSMillion,NHS Million,https://twitter.com/NHSMillion/status/949318578569994240,[],955,44,1748,"UK (Labour OR Conservative OR Parliament OR Government OR ""Lib OR dems"" OR ""liberal OR democrats"")",May and Hunt dine out on the notion that NHS spending has increased year on year under them  But the same could be said of any UK government since the dawn of time  This shows the real truth about NHS spending under this government - pls RT if you think everyone should be aware  https://t.co/CZOFT31u9B,0.0,0.897,0.103,0.6059,16:36:01
647,949279323097149442,949279323097149442,1515160802000.0,2018-01-05,BREAKING: Belize government has passed a law that will prevent oil exploration in the waters of the Barrier Reef - this #WorldHeritageSite is now protected from this threat!  https://t.co/KGlr8NPFy7,en,['worldheritagesite'],19719076,wwf_uk,WWF UK,https://twitter.com/wwf_uk/status/949279323097149442,[],663,13,269,"UK (Labour OR Conservative OR Parliament OR Government OR ""Lib OR dems"" OR ""liberal OR democrats"")",BREAKING: Belize government has passed a law that will prevent oil exploration in the waters of the Barrier Reef - this #WorldHeritageSite is now protected from this threat!  https://t.co/KGlr8NPFy7,0.14,0.684,0.176,0.0,14:00:02
648,949274672180457472,949274672180457472,1515159693000.0,2018-01-05,Academic research suggests that as people age they become more Conservative. (Surprise!) The UK population is aging with more people over 65 than 18 to 25. Aaronovitch is mistaken thinking Brexiteers will die out and become a minority.  https://t.co/YTtNxmEj8X,en,[],3899497877,EuroGuido,Euro Guido,https://twitter.com/EuroGuido/status/949274672180457472,['http://eprints.lse.ac.uk/56280/1/democraticaudit.com-Age_significantly_impacts_on_the_choices_that_voters_make_at_elections.pdf'],191,27,90,"UK (Labour OR Conservative OR Parliament OR Government OR ""Lib OR dems"" OR ""liberal OR democrats"")",Academic research suggests that as people age they become more Conservative. (Surprise!) The UK population is aging with more people over 65 than 18 to 25. Aaronovitch is mistaken thinking Brexiteers will die out and become a minority.  https://t.co/YTtNxmEj8X,0.148,0.799,0.053,-0.6501,13:41:33
649,949242124230381568,949242124230381568,1515151933000.0,2018-01-05,"Great UK economic news to start the year:  - Top European destination in 2017 for tech investment, more than Germany, France, Spain &amp; Ireland combined @CityAM   - Largest quarterly rise in labour productivity in 7 years @ONS   More to do, but very encouraging   #Conservatives",en,['conservatives'],20052899,sajidjavid,Sajid Javid,https://twitter.com/sajidjavid/status/949242124230381568,[],195,14,110,"UK (Labour OR Conservative OR Parliament OR Government OR ""Lib OR dems"" OR ""liberal OR democrats"")","Great UK economic news to start the year:  - Top European destination in 2017 for tech investment, more than Germany, France, Spain &amp; Ireland combined @CityAM   - Largest quarterly rise in labour productivity in 7 years @ONS   More to do, but very encouraging   #Conservatives",0.0,0.82,0.18,0.8397,11:32:13
650,949167976858705920,949167976858705920,1515134255000.0,2018-01-05,"Oldies before we pop-off, our job is to teach the young just how  Parliament lied to the British people to take UK into the EU. Get them  to Google 'Foreign Office Document 30/1048'. So they can read the truth. As one gets older one gets wiser to Parliament lies.",en,[],2733816872,davidericstan,David Stanley,https://twitter.com/davidericstan/status/949167976858705920,[],167,19,135,"UK (Labour OR Conservative OR Parliament OR Government OR ""Lib OR dems"" OR ""liberal OR democrats"")","Oldies before we pop-off, our job is to teach the young just how  Parliament lied to the British people to take UK into the EU. Get them  to Google 'Foreign Office Document 30/1048'. So they can read the truth. As one gets older one gets wiser to Parliament lies.",0.098,0.82,0.082,-0.2263,06:37:35
651,950140266010284037,950135050657587200,1515366066000.0,2018-01-07,"“Last month, a two-year investigation by BuzzFeed News revealed explosive evidence pointing to Russia in 14 suspicious deaths on British soil that the UK government had largely ignored.”",en,[],18382184,AdamParkhomenko,Adam Parkhomenko,https://twitter.com/AdamParkhomenko/status/950140266010284037,[],389,4,176,"UK (Labour OR Conservative OR Parliament OR Government OR ""Lib OR dems"" OR ""liberal OR democrats"")","“Last month, a two-year investigation by BuzzFeed News revealed explosive evidence pointing to Russia in 14 suspicious deaths on British soil that the UK government had largely ignored.”",0.085,0.915,0.0,-0.3612,23:01:06
652,950129885678395392,950129885678395392,1515363591000.0,2018-01-07,Back to Parliament tomorrow for another year to witness the UK indulging in unprecedented national self harm as their chaotic and clueless Brexit continues to unravel.,en,[],276868661,PeteWishart,Pete Wishart,https://twitter.com/PeteWishart/status/950129885678395392,[],576,28,270,"UK (Labour OR Conservative OR Parliament OR Government OR ""Lib OR dems"" OR ""liberal OR democrats"")",Back to Parliament tomorrow for another year to witness the UK indulging in unprecedented national self harm as their chaotic and clueless Brexit continues to unravel.,0.286,0.714,0.0,-0.8481,22:19:51
653,950096368676294656,950096368676294656,1515355600000.0,2018-01-07,Here's the REAL Scottish NHS story...  The Scottish branch of the Labour Party is running an intensive campaign of deceit against Scotland's NHS because it is the most successful NHS in the UK making the SNP gvt look good. Read the stories and you will see how contrived they are.,en,[],2787759816,mykilmarnock,Frank Beattie,https://twitter.com/mykilmarnock/status/950096368676294656,[],210,2,175,"UK (Labour OR Conservative OR Parliament OR Government OR ""Lib OR dems"" OR ""liberal OR democrats"")",Here's the REAL Scottish NHS story...  The Scottish branch of the Labour Party is running an intensive campaign of deceit against Scotland's NHS because it is the most successful NHS in the UK making the SNP gvt look good. Read the stories and you will see how contrived they are.,0.051,0.784,0.165,0.7713,20:06:40
654,950031802831462405,950031802831462405,1515340207000.0,2018-01-07,"In Wales, Labour signed up to a white paper with @Plaid_Cymru arguing that its in this country’s best interests to participate in the single market. At UK level, the party seems to be doing everything to frustrate that. #LabourFail    https://t.co/cWsXGUmv2N",en,['labourfail'],14450739,LeanneWood,Leanne Wood 💚💛,https://twitter.com/LeanneWood/status/950031802831462405,['https://amp.theguardian.com/politics/2018/jan/07/jeremy-corbyn-lacks-leadership-for-snubbing-brexit-coalition?CMP=share_btn_tw&__twitter_impression=true'],237,29,180,"UK (Labour OR Conservative OR Parliament OR Government OR ""Lib OR dems"" OR ""liberal OR democrats"")","In Wales, Labour signed up to a white paper with @Plaid_Cymru arguing that its in this country’s best interests to participate in the single market. At UK level, the party seems to be doing everything to frustrate that. #LabourFail    https://t.co/cWsXGUmv2N",0.12,0.701,0.178,0.4404,15:50:07
655,949995692273086465,949995692273086465,1515331597000.0,2018-01-07,I joined Labour to help Corbyn bring democratic socialism to the UK after 40yrs of uninterrupted neoliberal oligarchy. Staying in the EU is of secondary importance. I also fully endorse Corbyn's policy of letting David Davis fuck up #Brexit all by himself. It's working a treat.  https://t.co/heF50D0gGt,en,['brexit'],4203239195,OwenPaintbrush,Frank Owen's Legendary Paintbrush🥀🇵🇸🇾🇪,https://twitter.com/OwenPaintbrush/status/949995692273086465,['https://twitter.com/strolltoitaly/status/949981696325246976'],185,16,86,"UK (Labour OR Conservative OR Parliament OR Government OR ""Lib OR dems"" OR ""liberal OR democrats"")",I joined Labour to help Corbyn bring democratic socialism to the UK after 40yrs of uninterrupted neoliberal oligarchy. Staying in the EU is of secondary importance. I also fully endorse Corbyn's policy of letting David Davis fuck up #Brexit all by himself. It's working a treat.  https://t.co/heF50D0gGt,0.063,0.75,0.187,0.7178,13:26:37
656,949992257603727361,949992257603727361,1515330778000.0,2018-01-07,SCOTLAND: Scottish exports in 2015*  63% to the Rest of the UK 21% to the Rest of the World 16% to the EU27  * Data released by the Scottish Government on 25 January 2017.,en,[],555370896,Rob_Kimbell,Robert Kimbell,https://twitter.com/Rob_Kimbell/status/949992257603727361,[],250,23,233,"UK (Labour OR Conservative OR Parliament OR Government OR ""Lib OR dems"" OR ""liberal OR democrats"")",SCOTLAND: Scottish exports in 2015*  63% to the Rest of the UK 21% to the Rest of the World 16% to the EU27  * Data released by the Scottish Government on 25 January 2017.,0.0,1.0,0.0,0.0,13:12:58
657,949824574073528320,949824574073528320,1515290800000.0,2018-01-07,John Hurt is absolutely right; can anyone actually explain why the UK government wants change in this critical area?  https://t.co/aBQpw6jnHR,en,[],90146161,JoePajak,Dr Joe Pajak CSci FRSC 🇪🇺 🌬Covid is airborne,https://twitter.com/JoePajak/status/949824574073528320,['https://twitter.com/onnyponny/status/825672000400154625'],144,9,119,"UK (Labour OR Conservative OR Parliament OR Government OR ""Lib OR dems"" OR ""liberal OR democrats"")",John Hurt is absolutely right; can anyone actually explain why the UK government wants change in this critical area?  https://t.co/aBQpw6jnHR,0.251,0.749,0.0,-0.7206,02:06:40
658,949824549805285376,949824549805285376,1515290794000.0,2018-01-07,"If you didn’t vote for @theSNP, If you hate Nicola Sturgeon, If you think independence is anti-English...  It doesn’t matter. You still have the best NHS in the UK, the best transportation, free tuition, and the best government of the four nations.  Thanks to @theSNP.",en,[],18783908,yaakovsloman,Ya’akov Sloman,https://twitter.com/yaakovsloman/status/949824549805285376,[],939,25,463,"UK (Labour OR Conservative OR Parliament OR Government OR ""Lib OR dems"" OR ""liberal OR democrats"")","If you didn’t vote for @theSNP, If you hate Nicola Sturgeon, If you think independence is anti-English...  It doesn’t matter. You still have the best NHS in the UK, the best transportation, free tuition, and the best government of the four nations.  Thanks to @theSNP.",0.06,0.617,0.323,0.9451,02:06:34
659,950487433719828481,950487433719828481,1515448838000.0,2018-01-08,"Seriously? SERIOUSLY!?  The UK government screeches ""no deal is better than a bad deal"" to the rafters - and then whines when the EU side spells out the consequences of ""no deal""?  What the **** did they think would happen? And do they realise how stupid they look??  https://t.co/7OECZlm22L",en,[],2334732225,StevePeers,Steve Peers,https://twitter.com/StevePeers/status/950487433719828481,['https://twitter.com/PickardJE/status/950481366415757314'],1639,66,1006,"UK (Labour OR Conservative OR Parliament OR Government OR ""Lib OR dems"" OR ""liberal OR democrats"")","Seriously? SERIOUSLY!?  The UK government screeches ""no deal is better than a bad deal"" to the rafters - and then whines when the EU side spells out the consequences of ""no deal""?  What the **** did they think would happen? And do they realise how stupid they look??  https://t.co/7OECZlm22L",0.247,0.705,0.048,-0.9039,22:00:38
660,950475738037342208,950475738037342208,1515446049000.0,2018-01-08,"Surely the Government hasn't forgotten to announce a new Minister for Women and Equalities during its reshuffle that was going to promote, erm, women and equality?",en,[],3092283615,WEP_UK,Women's Equality Party,https://twitter.com/WEP_UK/status/950475738037342208,[],396,12,168,"UK (Labour OR Conservative OR Parliament OR Government OR ""Lib OR dems"" OR ""liberal OR democrats"")","Surely the Government hasn't forgotten to announce a new Minister for Women and Equalities during its reshuffle that was going to promote, erm, women and equality?",0.0,0.762,0.238,0.7324,21:14:09
661,950473503207239680,950473503207239680,1515445516000.0,2018-01-08,"As the dominant political party in the UK, the Tories have been exposed as really rather sad. Incapable of change, unable to embrace reform, or to promote genuine talent from within their own ranks. The most distressing thing of all is that the Labour Party is far, far worse.",en,[],555370896,Rob_Kimbell,Robert Kimbell,https://twitter.com/Rob_Kimbell/status/950473503207239680,[],203,15,86,"UK (Labour OR Conservative OR Parliament OR Government OR ""Lib OR dems"" OR ""liberal OR democrats"")","As the dominant political party in the UK, the Tories have been exposed as really rather sad. Incapable of change, unable to embrace reform, or to promote genuine talent from within their own ranks. The most distressing thing of all is that the Labour Party is far, far worse.",0.207,0.593,0.199,-0.1368,21:05:16
662,950455151692865537,950455151692865537,1515441141000.0,2018-01-08,"Education Secretary Justine Greening quits UK government after refusing job in Work &amp; Pensions department, @bbclaurak says  https://t.co/Xv6CJ0WaSO #cabinetreshuffle",en,['cabinetreshuffle'],5402612,BBCBreaking,BBC Breaking News,https://twitter.com/BBCBreaking/status/950455151692865537,['http://bbc.in/2FdoorT'],584,108,443,"UK (Labour OR Conservative OR Parliament OR Government OR ""Lib OR dems"" OR ""liberal OR democrats"")","Education Secretary Justine Greening quits UK government after refusing job in Work &amp; Pensions department, @bbclaurak says  https://t.co/Xv6CJ0WaSO #cabinetreshuffle",0.13,0.87,0.0,-0.4019,19:52:21
663,950440108573982724,950440108573982724,1515437554000.0,2018-01-08,"Just got FOI back. It turns out that, just like David Davis with the EU,  the SNP Government have done no economic impact assesment of being  outside a customs union with our biggest trading partner, the UK.  https://t.co/FZLFQpRB9F",en,[],153817010,blairmcdougall,Blair McDougall,https://twitter.com/blairmcdougall/status/950440108573982724,['https://medium.com/@blairmcdougall/what-sort-of-politician-would-do-this-8341c9173ff3'],189,56,163,"UK (Labour OR Conservative OR Parliament OR Government OR ""Lib OR dems"" OR ""liberal OR democrats"")","Just got FOI back. It turns out that, just like David Davis with the EU,  the SNP Government have done no economic impact assesment of being  outside a customs union with our biggest trading partner, the UK.  https://t.co/FZLFQpRB9F",0.054,0.885,0.061,0.0772,18:52:34
664,950412966830190593,950412966830190593,1515431083000.0,2018-01-08,"Five years ago, the UK Government announced that it would implement an overdue ban on wild animals in circuses in England. @michaelgove has now said that this will finally be brought before MPs once parliamentary time allows. Let's hope 2018 sees a ban!  https://t.co/azqC04hMY7  https://t.co/cr2pDx8TNq",en,[],15288851,RSPCA_official,RSPCA (England & Wales),https://twitter.com/RSPCA_official/status/950412966830190593,['http://bit.ly/2meYKLe'],146,8,56,"UK (Labour OR Conservative OR Parliament OR Government OR ""Lib OR dems"" OR ""liberal OR democrats"")","Five years ago, the UK Government announced that it would implement an overdue ban on wild animals in circuses in England. @michaelgove has now said that this will finally be brought before MPs once parliamentary time allows. Let's hope 2018 sees a ban!  https://t.co/azqC04hMY7  https://t.co/cr2pDx8TNq",0.143,0.802,0.055,-0.68,17:04:43
665,950401785000275968,950401785000275968,1515428417000.0,2018-01-08,"Hearing that Labour is haemmoraging members again because of their Brexit position.  The UK needs a strong Labour opposition, so for the love of all things holy, support a referendum and reap the rewards!  #fbpe",en,['fbpe'],721026242,JCHannah77,Jon Hannah #FBCoalition2024,https://twitter.com/JCHannah77/status/950401785000275968,[],455,32,232,"UK (Labour OR Conservative OR Parliament OR Government OR ""Lib OR dems"" OR ""liberal OR democrats"")","Hearing that Labour is haemmoraging members again because of their Brexit position.  The UK needs a strong Labour opposition, so for the love of all things holy, support a referendum and reap the rewards!  #fbpe",0.0,0.691,0.309,0.9307,16:20:17
666,950385015501873153,950385015501873153,1515424419000.0,2018-01-08,"Labour must ditch their largely meaningless amendment, which blatantly fudges whether the UK should stay in the Single Market and back our amendment instead &gt;  https://t.co/Ac6aay1h3K  https://t.co/2KNQ5Cl8L9",en,[],5680622,LibDems,Liberal Democrats,https://twitter.com/LibDems/status/950385015501873153,['https://www.libdems.org.uk/single-market'],186,14,164,"UK (Labour OR Conservative OR Parliament OR Government OR ""Lib OR dems"" OR ""liberal OR democrats"")","Labour must ditch their largely meaningless amendment, which blatantly fudges whether the UK should stay in the Single Market and back our amendment instead &gt;  https://t.co/Ac6aay1h3K  https://t.co/2KNQ5Cl8L9",0.1,0.9,0.0,-0.4404,15:13:39
667,950353674555060224,950341290629136384,1515416947000.0,2018-01-08,"@RossThomson_MP @HouseofCommons Ross, this is a UK issue.  Why don’t you and your government correct this wrong on women?",en,[],275241937,jimmacr,Jim Rennie,https://twitter.com/jimmacr/status/950353674555060224,[],141,5,55,"UK (Labour OR Conservative OR Parliament OR Government OR ""Lib OR dems"" OR ""liberal OR democrats"")","@RossThomson_MP @HouseofCommons Ross, this is a UK issue.  Why don’t you and your government correct this wrong on women?",0.168,0.832,0.0,-0.561,13:09:07
668,950326445972377600,950326445972377600,1515410455000.0,2018-01-08,The British public favours serious reforms of Parliament to remove automatic seats for bishops in the House of Lords. (The only other sovereign state that puts clerics in Parliament is the Islamic Republic of Iran.)  https://t.co/Viw2R98A5a,en,[],46686058,Humanists_UK,Humanists UK,https://twitter.com/Humanists_UK/status/950326445972377600,['https://humanism.org.uk/2017/12/26/public-wants-less-religion-in-politics-and-bishops-out-the-lords/'],295,9,184,"UK (Labour OR Conservative OR Parliament OR Government OR ""Lib OR dems"" OR ""liberal OR democrats"")",The British public favours serious reforms of Parliament to remove automatic seats for bishops in the House of Lords. (The only other sovereign state that puts clerics in Parliament is the Islamic Republic of Iran.)  https://t.co/Viw2R98A5a,0.034,0.892,0.073,0.3612,11:20:55
669,951234214199988224,951234214199988224,1515626884000.0,2018-01-10,Julian Assange's bid for diplomatic status rejected by UK government  https://t.co/UzPbR7sVbF,en,[],87818409,guardian,The Guardian,https://twitter.com/guardian/status/951234214199988224,['https://trib.al/FoJnOvJ'],454,70,298,"UK (Labour OR Conservative OR Parliament OR Government OR ""Lib OR dems"" OR ""liberal OR democrats"")",Julian Assange's bid for diplomatic status rejected by UK government  https://t.co/UzPbR7sVbF,0.248,0.752,0.0,-0.5106,23:28:04
