,id,conversation_id,created_at,date,tweet,language,hashtags,user_id,username,name,link,urls,nlikes,nreplies,nretweets,search,new_tweet,neg,neu,pos,compound,time
353,930516226408898561,930516226408898561,1510687331000.0,2017-11-14,Sad to see the vast majority of Labour MP’s abstain on @HywelPlaidCymru’s amendment 79 - which necessitates consent of the Governments of the devolved nations before the UK leaves the EU.  #EUWithdrawalBill,en,['euwithdrawalbill'],2981900049,HannahB4LiviMP,Hannah Bardell SNP MP 🏴󠁧󠁢󠁳󠁣󠁴󠁿🏳️‍🌈🏳️‍⚧️,https://twitter.com/HannahB4LiviMP/status/930516226408898561,[],231,23,206,"UK (Labour OR Conservative OR Parliament OR Government OR ""Lib OR dems"" OR ""liberal OR democrats"")",Sad to see the vast majority of Labour MP’s abstain on @HywelPlaidCymru’s amendment 79 - which necessitates consent of the Governments of the devolved nations before the UK leaves the EU.  #EUWithdrawalBill,0.089,0.857,0.054,-0.296,19:22:11
354,930460893116235776,930459964447100933,1510674138000.0,2017-11-14,"1/ Sessions says to his knowledge Papadopoulos was not authorized by the Trump campaign to speak to any foreign government on behalf on the campaign. In fact, Papadopoulos repeatedly spoke to the governments of Greece and the UK on the campaign's behalf and the campaign knew it.",en,[],3223426134,SethAbramson,Seth Abramson,https://twitter.com/SethAbramson/status/930460893116235776,[],1705,22,511,"UK (Labour OR Conservative OR Parliament OR Government OR ""Lib OR dems"" OR ""liberal OR democrats"")","1/ Sessions says to his knowledge Papadopoulos was not authorized by the Trump campaign to speak to any foreign government on behalf on the campaign. In fact, Papadopoulos repeatedly spoke to the governments of Greece and the UK on the campaign's behalf and the campaign knew it.",0.0,1.0,0.0,0.0,15:42:18
355,930458712212459521,930458712212459521,1510673618000.0,2017-11-14,UK Government under increasing pressure to ban wild animals in circuses after politicians in Ireland and Italy voted to end the practice last week  https://t.co/WoLEEPE2kP,en,[],7587032,SkyNews,Sky News,https://twitter.com/SkyNews/status/930458712212459521,['https://trib.al/wDmBMiR'],186,21,100,"UK (Labour OR Conservative OR Parliament OR Government OR ""Lib OR dems"" OR ""liberal OR democrats"")",UK Government under increasing pressure to ban wild animals in circuses after politicians in Ireland and Italy voted to end the practice last week  https://t.co/WoLEEPE2kP,0.201,0.799,0.0,-0.7003,15:33:38
356,930426595755556864,930426595755556864,1510665961000.0,2017-11-14,The EU will be lucky if there is still a UK government to negotiate with by December.,en,[],21666641,thomasbrake,Tom Brake,https://twitter.com/thomasbrake/status/930426595755556864,[],866,40,342,"UK (Labour OR Conservative OR Parliament OR Government OR ""Lib OR dems"" OR ""liberal OR democrats"")",The EU will be lucky if there is still a UK government to negotiate with by December.,0.0,0.851,0.149,0.4215,13:26:01
357,930419510074658818,930419510074658818,1510664272000.0,2017-11-14,"Basic Income is an idea that can unite left and right.  Basic Income would eliminate poverty in the UK.  Basic Income would replace the massively bureaucratic welfare state.   Basic Income would give a safety net to business owners, incentivising work.  Labour should embrace it.  https://t.co/PPqMdHfmSr",en,[],739444402012180480,LabourUBI,Labour Basic Income,https://twitter.com/LabourUBI/status/930419510074658818,['https://twitter.com/labourlist/status/930367062756618240'],229,21,124,"UK (Labour OR Conservative OR Parliament OR Government OR ""Lib OR dems"" OR ""liberal OR democrats"")","Basic Income is an idea that can unite left and right.  Basic Income would eliminate poverty in the UK.  Basic Income would replace the massively bureaucratic welfare state.   Basic Income would give a safety net to business owners, incentivising work.  Labour should embrace it.  https://t.co/PPqMdHfmSr",0.065,0.833,0.101,0.2023,12:57:52
358,930412395138297857,930412395138297857,1510662575000.0,2017-11-14,#brexit Why does Labour's @Keir_Starmer  want to give European court continued jurisdiction in the UK? It will be a completely foreign court after Brexit.,en,['brexit'],1944466748,toryboypierce,Andrew Pierce,https://twitter.com/toryboypierce/status/930412395138297857,[],255,63,109,"UK (Labour OR Conservative OR Parliament OR Government OR ""Lib OR dems"" OR ""liberal OR democrats"")",#brexit Why does Labour's @Keir_Starmer  want to give European court continued jurisdiction in the UK? It will be a completely foreign court after Brexit.,0.0,0.947,0.053,0.0772,12:29:35
359,930381438834348033,930372475795501056,1510655195000.0,2017-11-14,"Article 50 is revocable and, as the the former German Finance Minister (now Speaker of their parliament), Wolfgang Schäuble says here - along with other EU leaders - it is open to the UK to change its mind at the end of this process  https://t.co/Qb4JFJQgn3 /7",en,[],33300246,ChukaUmunna,ChukaUmunna,https://twitter.com/ChukaUmunna/status/930381438834348033,['https://twitter.com/Open_Britain/status/928922660213489664/video/1'],515,52,428,"UK (Labour OR Conservative OR Parliament OR Government OR ""Lib OR dems"" OR ""liberal OR democrats"")","Article 50 is revocable and, as the the former German Finance Minister (now Speaker of their parliament), Wolfgang Schäuble says here - along with other EU leaders - it is open to the UK to change its mind at the end of this process  https://t.co/Qb4JFJQgn3 /7",0.0,1.0,0.0,0.0,10:26:35
360,930381309033287680,930372475795501056,1510655164000.0,2017-11-14,"German and UK businesses who have spoken to UK Government Ministers all told me that they do not believe Theresa May's Ministers fully appreciate the adverse practical consequences of the type of Brexit they are pursuing (taking us out of the Single Market, ruling out EEA etc) /6",en,[],33300246,ChukaUmunna,ChukaUmunna,https://twitter.com/ChukaUmunna/status/930381309033287680,[],182,10,129,"UK (Labour OR Conservative OR Parliament OR Government OR ""Lib OR dems"" OR ""liberal OR democrats"")","German and UK businesses who have spoken to UK Government Ministers all told me that they do not believe Theresa May's Ministers fully appreciate the adverse practical consequences of the type of Brexit they are pursuing (taking us out of the Single Market, ruling out EEA etc) /6",0.053,0.889,0.058,0.0591,10:26:04
361,930374654375669760,930372475795501056,1510653577000.0,2017-11-14,"German businesses think the UK leaving the EU is bad for them and for us.  They would be very happy to see the UK change its mind if, at the end of the process, Brexit is not what we thought; German businesses do not anticipate their Government having any issue with that /4",en,[],33300246,ChukaUmunna,ChukaUmunna,https://twitter.com/ChukaUmunna/status/930374654375669760,[],211,7,106,"UK (Labour OR Conservative OR Parliament OR Government OR ""Lib OR dems"" OR ""liberal OR democrats"")","German businesses think the UK leaving the EU is bad for them and for us.  They would be very happy to see the UK change its mind if, at the end of the process, Brexit is not what we thought; German businesses do not anticipate their Government having any issue with that /4",0.06,0.872,0.068,0.1263,09:59:37
362,930359020921262080,930359020921262080,1510649850000.0,2017-11-14,I considered this as my private member’s bill but was told I wouldn’t win parliamentary support from the UK Government.  https://t.co/zlhS0lxJM2,en,[],2327654917,MrJohnNicolson,JOHN NICOLSON M.P.,https://twitter.com/MrJohnNicolson/status/930359020921262080,['https://twitter.com/ninetyfive_uk/status/930357222336540672'],152,9,146,"UK (Labour OR Conservative OR Parliament OR Government OR ""Lib OR dems"" OR ""liberal OR democrats"")",I considered this as my private member’s bill but was told I wouldn’t win parliamentary support from the UK Government.  https://t.co/zlhS0lxJM2,0.0,0.685,0.315,0.8674,08:57:30
363,930344777471709184,930344777471709184,1510646454000.0,2017-11-14,"A bit rich for Theresa May to accuse Putin's government of meddling in elections after UK Gov meddled in Scotland's indyref, including the prime minister breaching purdah rules to bribe the Scots to vote 'No' and using civil service as a propaganda tool against Scotland.#Duress",en,['duress'],1143112783,JamesMacEachern,𝔍𝔞𝔪𝔢𝔰 𝔐𝔞𝔠𝔈𝔞𝔠𝔥𝔢𝔯𝔫 🏴󠁧󠁢󠁳󠁣󠁴󠁿,https://twitter.com/JamesMacEachern/status/930344777471709184,[],148,6,96,"UK (Labour OR Conservative OR Parliament OR Government OR ""Lib OR dems"" OR ""liberal OR democrats"")","A bit rich for Theresa May to accuse Putin's government of meddling in elections after UK Gov meddled in Scotland's indyref, including the prime minister breaching purdah rules to bribe the Scots to vote 'No' and using civil service as a propaganda tool against Scotland.#Duress",0.112,0.817,0.072,0.0,08:00:54
364,930913754543517696,930913754543517696,1510782109000.0,2017-11-15,"My Government is committed to the UK tech sector, encouraging its continued growth and spreading its benefits across the country. Here’s what we’re doing to strengthen the sector:  https://t.co/iy3TiRsbh3  https://t.co/d11ERINS4o",en,[],747807250819981312,theresa_may,Theresa May,https://twitter.com/theresa_may/status/930913754543517696,['https://www.gov.uk/government/news/pm-reaffirms-commitment-to-uks-world-class-tech-sector'],928,284,347,"UK (Labour OR Conservative OR Parliament OR Government OR ""Lib OR dems"" OR ""liberal OR democrats"")","My Government is committed to the UK tech sector, encouraging its continued growth and spreading its benefits across the country. Here’s what we’re doing to strengthen the sector:  https://t.co/iy3TiRsbh3  https://t.co/d11ERINS4o",0.0,0.658,0.342,0.9001,21:41:49
365,930881357043191808,930881357043191808,1510774385000.0,2017-11-15,"The Economist said ""lack of ID cards and stringent labour inspections"" are a huge draw for illegal immigrants to UK. It's time now to reconsider the case for the enforcement of a state-of-the-art sophisticated biometric ID card so all know exactly who everyone else is in reality.",en,[],555370896,Rob_Kimbell,Robert Kimbell,https://twitter.com/Rob_Kimbell/status/930881357043191808,[],259,33,150,"UK (Labour OR Conservative OR Parliament OR Government OR ""Lib OR dems"" OR ""liberal OR democrats"")","The Economist said ""lack of ID cards and stringent labour inspections"" are a huge draw for illegal immigrants to UK. It's time now to reconsider the case for the enforcement of a state-of-the-art sophisticated biometric ID card so all know exactly who everyone else is in reality.",0.108,0.785,0.108,0.0,19:33:05
366,930842839805816835,930842839805816835,1510765201000.0,2017-11-15,Unfortunately to have our donations matched by UK government it has to be UK residents only. BUT I promise to do another for non UK residents !!! Would never forget about you all.  https://t.co/yxAVBVe6VD,en,[],175098387,caitrionambalfe,Caitríona Balfe,https://twitter.com/caitrionambalfe/status/930842839805816835,['https://twitter.com/cbowlden/status/930838828062990336'],1534,102,126,"UK (Labour OR Conservative OR Parliament OR Government OR ""Lib OR dems"" OR ""liberal OR democrats"")",Unfortunately to have our donations matched by UK government it has to be UK residents only. BUT I promise to do another for non UK residents !!! Would never forget about you all.  https://t.co/yxAVBVe6VD,0.044,0.805,0.151,0.628,17:00:01
367,930835743425089536,930835743425089536,1510763509000.0,2017-11-15,"An ex-EU official just laughed at me down the phone when I asked how they are going to sort out the Irish border. ""People were laughing in the corridors"" when they read the UK government's position paper on the Northern Ireland, they said.",en,[],616307352,adampayne26,Adam Payne,https://twitter.com/adampayne26/status/930835743425089536,[],628,22,565,"UK (Labour OR Conservative OR Parliament OR Government OR ""Lib OR dems"" OR ""liberal OR democrats"")","An ex-EU official just laughed at me down the phone when I asked how they are going to sort out the Irish border. ""People were laughing in the corridors"" when they read the UK government's position paper on the Northern Ireland, they said.",0.0,0.869,0.131,0.7351,16:31:49
368,930830717038268418,930825406248374273,1510762311000.0,2017-11-15,"That government is finally opening up about the Vulnerabilities Equities Process is positive, but Joyce's refusal to acknowledge, confront, and discuss remediating the problems highlighted by NSA's ETERNAL suite knocking out US &amp; UK hospitals shows we have a long way to go.",en,[],2916305152,Snowden,Edward Snowden,https://twitter.com/Snowden/status/930830717038268418,[],413,19,167,"UK (Labour OR Conservative OR Parliament OR Government OR ""Lib OR dems"" OR ""liberal OR democrats"")","That government is finally opening up about the Vulnerabilities Equities Process is positive, but Joyce's refusal to acknowledge, confront, and discuss remediating the problems highlighted by NSA's ETERNAL suite knocking out US &amp; UK hospitals shows we have a long way to go.",0.143,0.809,0.048,-0.5574,16:11:51
369,930770251087843328,930770251087843328,1510747895000.0,2017-11-15,"Sinn Fein boycotting Assembly, Executive and Parliament, now running to their opponents in Dublin pleading for relevance. Sec of State confirms to me Northern Ireland matters are for UK Govt and Parliament.",en,[],104845115,NigelDoddsDUP,Nigel Dodds,https://twitter.com/NigelDoddsDUP/status/930770251087843328,[],158,28,61,"UK (Labour OR Conservative OR Parliament OR Government OR ""Lib OR dems"" OR ""liberal OR democrats"")","Sinn Fein boycotting Assembly, Executive and Parliament, now running to their opponents in Dublin pleading for relevance. Sec of State confirms to me Northern Ireland matters are for UK Govt and Parliament.",0.08,0.888,0.033,-0.3818,12:11:35
370,931208389408980992,931208389408980992,1510852355000.0,2017-11-16,Leavers can't complain. The ref was advisory. Both the Tories and Labour took the advice and started Brexit. But it's turned out to be very harmful for the UK. So we are changing our minds.,en,[],774510439824822273,BrexitBin,Brexit Bin 🇪🇺🇬🇧🇩🇪🕊🇺🇦 #BrexitReality,https://twitter.com/BrexitBin/status/931208389408980992,[],374,13,185,"UK (Labour OR Conservative OR Parliament OR Government OR ""Lib OR dems"" OR ""liberal OR democrats"")",Leavers can't complain. The ref was advisory. Both the Tories and Labour took the advice and started Brexit. But it's turned out to be very harmful for the UK. So we are changing our minds.,0.0,0.956,0.044,0.1419,17:12:35
371,931202397782925313,931202397782925313,1510850927000.0,2017-11-16,"Pleased that @GavinWilliamson has visited @HMSQNLZ so early in his tenure as Defence Secretary. Carriers may be operated by @RoyalNavy, but they are a national asset, which work across all arms of Government to support UK trade, aid and security.  https://t.co/Ow4UaPvHAz  https://t.co/PpUYiRziCv",en,[],752508784862453760,AdmPhilipJones,Former First Sea Lord 2016-2019,https://twitter.com/AdmPhilipJones/status/931202397782925313,['http://ow.ly/Sq7y30gCFzQ'],159,11,52,"UK (Labour OR Conservative OR Parliament OR Government OR ""Lib OR dems"" OR ""liberal OR democrats"")","Pleased that @GavinWilliamson has visited @HMSQNLZ so early in his tenure as Defence Secretary. Carriers may be operated by @RoyalNavy, but they are a national asset, which work across all arms of Government to support UK trade, aid and security.  https://t.co/Ow4UaPvHAz  https://t.co/PpUYiRziCv",0.0,0.739,0.261,0.9011,16:48:47
372,931102174578438144,931102174578438144,1510827032000.0,2017-11-16,UK parliament has termed Elections in Kenya “ total chaos and fraudulent “ 😂😂😂😂😂😂😂😂😂😂😂😂😂 #SupremeCourtKE,en,['supremecourtke'],506956991,Asamoh_,Rein,https://twitter.com/Asamoh_/status/931102174578438144,[],503,31,267,"UK (Labour OR Conservative OR Parliament OR Government OR ""Lib OR dems"" OR ""liberal OR democrats"")",UK parliament has termed Elections in Kenya “ total chaos and fraudulent “ 😂😂😂😂😂😂😂😂😂😂😂😂😂 #SupremeCourtKE,0.243,0.385,0.373,0.9803,10:10:32
373,931074766156521472,931074766156521472,1510820497000.0,2017-11-16,"John McDonnell (Shadow #Labour Chancellor) should heed the words of Abraham Lincoln: You cannot make a poor man rich, by making a rich man poor. Or - if you have higher corporation tax in the UK than elsewhere, you drive business abroad.",en,['labour'],19058678,Mike_Fabricant,Michael Fabricant 🇬🇧🇺🇦,https://twitter.com/Mike_Fabricant/status/931074766156521472,[],355,107,189,"UK (Labour OR Conservative OR Parliament OR Government OR ""Lib OR dems"" OR ""liberal OR democrats"")","John McDonnell (Shadow #Labour Chancellor) should heed the words of Abraham Lincoln: You cannot make a poor man rich, by making a rich man poor. Or - if you have higher corporation tax in the UK than elsewhere, you drive business abroad.",0.061,0.747,0.192,0.7687,08:21:37
374,931074615748767744,931074615748767744,1510820461000.0,2017-11-16,Conclusion has to be that Scotland is only nominally their country. Scottish Labour’s real allegiance is to Britain. UK first. Scotland second.  https://t.co/Qsi3KRtI6U,en,[],1854262416,DerekBateman2,Derek Bateman,https://twitter.com/DerekBateman2/status/931074615748767744,['https://twitter.com/mykilmarnock/status/930902744067727360'],448,27,468,"UK (Labour OR Conservative OR Parliament OR Government OR ""Lib OR dems"" OR ""liberal OR democrats"")",Conclusion has to be that Scotland is only nominally their country. Scottish Labour’s real allegiance is to Britain. UK first. Scotland second.  https://t.co/Qsi3KRtI6U,0.0,1.0,0.0,0.0,08:21:01
375,931668940820025345,931668940820025345,1510962159000.0,2017-11-17,"The brother of one of my peers, a young Sikh man from Scotland, is being held in India.He is a political activist who raises awareness of human rights violations. He has been tortured. He is one of our own. put pressure on the UK government to help Jaggi. #FreeJaggiNow  https://t.co/KRffwzufuV",en,['freejagginow'],54161618,sarahmck90,Sarah 🧡,https://twitter.com/sarahmck90/status/931668940820025345,['https://twitter.com/katiehunterbbc/status/931471155445354496'],638,9,534,"UK (Labour OR Conservative OR Parliament OR Government OR ""Lib OR dems"" OR ""liberal OR democrats"")","The brother of one of my peers, a young Sikh man from Scotland, is being held in India.He is a political activist who raises awareness of human rights violations. He has been tortured. He is one of our own. put pressure on the UK government to help Jaggi. #FreeJaggiNow  https://t.co/KRffwzufuV",0.159,0.794,0.047,-0.7579,23:42:39
376,931602089121386497,931602089121386497,1510946221000.0,2017-11-17,Leo Varadkar far too kind in saying the UK government hasn’t thought Brexit through. They haven’t thought full stop. Play hardball Leo!!,en,[],19644592,campbellclaret,ALASTAIR CAMPBELL,https://twitter.com/campbellclaret/status/931602089121386497,[],2909,983,940,"UK (Labour OR Conservative OR Parliament OR Government OR ""Lib OR dems"" OR ""liberal OR democrats"")",Leo Varadkar far too kind in saying the UK government hasn’t thought Brexit through. They haven’t thought full stop. Play hardball Leo!!,0.08,0.689,0.231,0.6351,19:17:01
377,931510013293711365,931510013293711365,1510924268000.0,2017-11-17,Cowards at the helm of affairs in the West. Here the Conservative Prime Minister of Great Britain quivers in fear as she responds to simple question about Islamist bullying in UK.   https://t.co/ihSFYoVILt,en,[],17537467,TarekFatah,Tarek Fatah,https://twitter.com/TarekFatah/status/931510013293711365,['https://twitter.com/rejialex7/status/930149328127131649/video/1'],231,52,168,"UK (Labour OR Conservative OR Parliament OR Government OR ""Lib OR dems"" OR ""liberal OR democrats"")",Cowards at the helm of affairs in the West. Here the Conservative Prime Minister of Great Britain quivers in fear as she responds to simple question about Islamist bullying in UK.   https://t.co/ihSFYoVILt,0.177,0.721,0.102,-0.4588,13:11:08
378,931502868519112704,928300450100711426,1510922564000.0,2017-11-17,@MyDoncaster @RufusHound Dear Doncaster Council you may want to think about being the face of all government in the UK.,en,[],240715298,briantaylor56,Brian Taylor,https://twitter.com/briantaylor56/status/931502868519112704,[],313,1,10,"UK (Labour OR Conservative OR Parliament OR Government OR ""Lib OR dems"" OR ""liberal OR democrats"")",@MyDoncaster @RufusHound Dear Doncaster Council you may want to think about being the face of all government in the UK.,0.0,0.822,0.178,0.4404,12:42:44
379,931477593932546048,931477593932546048,1510916539000.0,2017-11-17,Elephants need YOUR help! Urge the UK Government and the European Commission to end the ivory trade 🐘#BanIvory #WorthMoreAlive #SpeakOut4Eles  https://t.co/ngSsWNx0m0  https://t.co/Sy52EZY9ZJ,en,"['banivory', 'worthmorealive', 'speakout4eles']",20604674,BornFreeFDN,Born Free Foundation,https://twitter.com/BornFreeFDN/status/931477593932546048,['http://www.bornfree.org.uk/campaigns/elephants/news/article/?no_cache=1&tx_ttnews%5Btt_news%5D=2668#.Wg7BeON8hs4.twitter'],158,3,151,"UK (Labour OR Conservative OR Parliament OR Government OR ""Lib OR dems"" OR ""liberal OR democrats"")",Elephants need YOUR help! Urge the UK Government and the European Commission to end the ivory trade 🐘#BanIvory #WorthMoreAlive #SpeakOut4Eles  https://t.co/ngSsWNx0m0  https://t.co/Sy52EZY9ZJ,0.0,0.875,0.125,0.4574,11:02:19
380,931472677948313600,931472677948313600,1510915367000.0,2017-11-17,The NAO lays bare Government failure to reduce illegal &amp; harmful air pollution in our towns &amp; cities  – there’ll be tough questions over this scandal at Parliamentary Inquiry next week: UK government '10 years late' on air quality targets  https://t.co/x33MvfjdZG,en,[],80802900,CarolineLucas,Caroline Lucas,https://twitter.com/CarolineLucas/status/931472677948313600,['https://www.theguardian.com/environment/2017/nov/16/uk-government-10-years-late-on-air-quality-targets?CMP=share_btn_tw'],175,8,172,"UK (Labour OR Conservative OR Parliament OR Government OR ""Lib OR dems"" OR ""liberal OR democrats"")",The NAO lays bare Government failure to reduce illegal &amp; harmful air pollution in our towns &amp; cities  – there’ll be tough questions over this scandal at Parliamentary Inquiry next week: UK government '10 years late' on air quality targets  https://t.co/x33MvfjdZG,0.241,0.759,0.0,-0.8951,10:42:47
381,931455070541111296,931455070541111296,1510911169000.0,2017-11-17,The UK housing crisis is entirely artificial and has been created by Labour/Tory/LibDem rapid mass immigration.   https://t.co/gyBXLroGfR,en,[],1017280993,davidkurten,David Kurten,https://twitter.com/davidkurten/status/931455070541111296,['https://www.thesun.co.uk/news/4915654/ministers-have-woefully-underestimated-the-huge-pressure-immigration-has-put-on-housing-claims-think-tank/amp/'],180,6,107,"UK (Labour OR Conservative OR Parliament OR Government OR ""Lib OR dems"" OR ""liberal OR democrats"")",The UK housing crisis is entirely artificial and has been created by Labour/Tory/LibDem rapid mass immigration.   https://t.co/gyBXLroGfR,0.194,0.711,0.095,-0.4767,09:32:49
382,932354888088150017,932346136047755264,1511125702000.0,2017-11-19,"@SophiaLorenFisk @dollymad1812 @chelseahandler In the UK a petition was set up and the government petitioned to protect the bees, by banning a bad agricultural chemical, which it did",en,[],21222912,littleimpressio,TaskMaster,https://twitter.com/littleimpressio/status/932354888088150017,[],212,4,44,"UK (Labour OR Conservative OR Parliament OR Government OR ""Lib OR dems"" OR ""liberal OR democrats"")","@SophiaLorenFisk @dollymad1812 @chelseahandler In the UK a petition was set up and the government petitioned to protect the bees, by banning a bad agricultural chemical, which it did",0.109,0.81,0.081,-0.2263,21:08:22
383,932244473932902403,932244473932902403,1511099377000.0,2017-11-19,A question for my UK peeps: this guy who literally says “where are all these unemployed people? There are no unemployed people” - HE’S the stable one in your government-in-tatters?  https://t.co/uWaxDPJYzC,en,[],130617778,KeithOlbermann,Keith Olbermann,https://twitter.com/KeithOlbermann/status/932244473932902403,['https://twitter.com/marrshow/status/932193412429647872'],285,79,97,"UK (Labour OR Conservative OR Parliament OR Government OR ""Lib OR dems"" OR ""liberal OR democrats"")",A question for my UK peeps: this guy who literally says “where are all these unemployed people? There are no unemployed people” - HE’S the stable one in your government-in-tatters?  https://t.co/uWaxDPJYzC,0.066,0.868,0.066,0.0,13:49:37
384,932227271229886464,932227271229886464,1511095276000.0,2017-11-19,"Also, Tory record on job creation now unmatched by any modern UK government  https://t.co/FHkKsluT3O",en,[],117366399,FraserNelson,Fraser Nelson,https://twitter.com/FraserNelson/status/932227271229886464,[],332,99,297,"UK (Labour OR Conservative OR Parliament OR Government OR ""Lib OR dems"" OR ""liberal OR democrats"")","Also, Tory record on job creation now unmatched by any modern UK government  https://t.co/FHkKsluT3O",0.084,0.779,0.136,0.2023,12:41:16
