,id,conversation_id,created_at,date,tweet,language,hashtags,user_id,username,name,link,urls,nlikes,nreplies,nretweets,search,new_tweet,neg,neu,pos,compound,time
918,963520348946747392,963520348946747392,1518556127000.0,2018-02-13,"Finance Minister @MathiasCormann argues that, with corporate tax, we need to remain competitive with the likes of the UK France &amp; the US. None of those countries have dividend imputation which makes the revenue to Government less in Australia #auspol",en,['auspol'],64705123,albericie,Emma Alberici,https://twitter.com/albericie/status/963520348946747392,[],574,49,469,"UK (Labour OR Conservative OR Parliament OR Government OR ""Lib OR dems"" OR ""liberal OR democrats"")","Finance Minister @MathiasCormann argues that, with corporate tax, we need to remain competitive with the likes of the UK France &amp; the US. None of those countries have dividend imputation which makes the revenue to Government less in Australia #auspol",0.059,0.839,0.102,0.2263,21:08:47
919,963496213885718529,963496213885718529,1518550372000.0,2018-02-13,"I'm sick of this misleading ""SNP austerity"" nonsense. The Scottish Government does not have the tools available to reverse UK austerity. Who campaigned to keep it that way? LABOUR. So who's responsible? LABOUR ARE.  https://t.co/G1FfDZSVWG",en,[],17674440,DouglasDaniel,Doug Daniel 🧀🏴󠁧󠁢󠁳󠁣󠁴󠁿🤝🇺🇦,https://twitter.com/DouglasDaniel/status/963496213885718529,['https://twitter.com/jeremycorbyn/status/963468853719261185'],554,17,442,"UK (Labour OR Conservative OR Parliament OR Government OR ""Lib OR dems"" OR ""liberal OR democrats"")","I'm sick of this misleading ""SNP austerity"" nonsense. The Scottish Government does not have the tools available to reverse UK austerity. Who campaigned to keep it that way? LABOUR. So who's responsible? LABOUR ARE.  https://t.co/G1FfDZSVWG",0.212,0.727,0.06,-0.7566,19:32:52
920,963471518239019008,963471518239019008,1518544485000.0,2018-02-13,Does anyone have any idea what is going to happen when the UK leaves the EU in March 2019? Labour? Conservatives? Anyone?   From this week's #Unspun with @mattforde (featuring an amazing interview by @afneil)  https://t.co/0lLzuG2Zw8,en,['unspun'],770548743498244096,DaveUnspun,Unspun with Matt Forde,https://twitter.com/DaveUnspun/status/963471518239019008,[],152,24,72,"UK (Labour OR Conservative OR Parliament OR Government OR ""Lib OR dems"" OR ""liberal OR democrats"")",Does anyone have any idea what is going to happen when the UK leaves the EU in March 2019? Labour? Conservatives? Anyone?   From this week's #Unspun with @mattforde (featuring an amazing interview by @afneil)  https://t.co/0lLzuG2Zw8,0.0,0.877,0.123,0.6966,17:54:45
921,963470658389803008,963468853719261185,1518544280000.0,2018-02-13,@jeremycorbyn Midlothinan ElectedMembers to UK Parliament  1955 David Pryde Labour 1959 James Hill Labour 1966 Alex Eadie Labour 1992 Eric Clarke Labour 2001 David Hamilton Labour 2015 Owen Thompson SNP 2017 Danielle Rowley Labour And Labour were in Government from 97 to 07. You have failed.,en,[],450587351,CatMackenzie7,Cat Mackenzie,https://twitter.com/CatMackenzie7/status/963470658389803008,[],304,11,146,"UK (Labour OR Conservative OR Parliament OR Government OR ""Lib OR dems"" OR ""liberal OR democrats"")",@jeremycorbyn Midlothinan ElectedMembers to UK Parliament  1955 David Pryde Labour 1959 James Hill Labour 1966 Alex Eadie Labour 1992 Eric Clarke Labour 2001 David Hamilton Labour 2015 Owen Thompson SNP 2017 Danielle Rowley Labour And Labour were in Government from 97 to 07. You have failed.,0.068,0.932,0.0,-0.5106,17:51:20
922,963410432504614912,963410432504614912,1518529921000.0,2018-02-13,The British government wants to convert the EU’s free trade agreements with other countries into UK deals.  This looks at the EU-South Korea agreement to illustrate where “grandfathering” might be easy and where it might not   https://t.co/1Hj2TRIrp4 via @wordpressdotcom,en,[],800055252,CoppetainPU,Peter Ungphakorn (also @CoppetainPU@tooting.ch),https://twitter.com/CoppetainPU/status/963410432504614912,['https://tradebetablog.wordpress.com/2018/02/13/grandfathering-eu-ftas/'],256,19,229,"UK (Labour OR Conservative OR Parliament OR Government OR ""Lib OR dems"" OR ""liberal OR democrats"")",The British government wants to convert the EU’s free trade agreements with other countries into UK deals.  This looks at the EU-South Korea agreement to illustrate where “grandfathering” might be easy and where it might not   https://t.co/1Hj2TRIrp4 via @wordpressdotcom,0.0,0.753,0.247,0.8885,13:52:01
923,963394881992478720,963394881992478720,1518526213000.0,2018-02-13,"Today, 2pm GMT, 9am EST, judge rules on whether to lift my UK arrest warrant following revelations of improper conduct by the UK government. Note that a win is a win, but even if we lose the first point today the hearing may immediately continue on another  https://t.co/LFGCOIS2ev",en,[],388983706,DefendAssange,Defend Assange Campaign,https://twitter.com/DefendAssange/status/963394881992478720,['https://www.theguardian.com/media/2018/feb/13/julian-assange-saga-judge-to-rule-on-arrest-warrant'],2218,315,970,"UK (Labour OR Conservative OR Parliament OR Government OR ""Lib OR dems"" OR ""liberal OR democrats"")","Today, 2pm GMT, 9am EST, judge rules on whether to lift my UK arrest warrant following revelations of improper conduct by the UK government. Note that a win is a win, but even if we lose the first point today the hearing may immediately continue on another  https://t.co/LFGCOIS2ev",0.097,0.814,0.089,-0.1154,12:50:13
924,963348184566325250,963348184566325250,1518515080000.0,2018-02-13,"This Government is leading the world in making sure that vile terrorist content is stamped out. Technology like this can heavily disrupt the terrorists' actions, prevent their poisonous propaganda and help keep people in the UK safe.  https://t.co/hIn1zMsQfN",en,[],747807250819981312,theresa_may,Theresa May,https://twitter.com/theresa_may/status/963348184566325250,[],770,359,262,"UK (Labour OR Conservative OR Parliament OR Government OR ""Lib OR dems"" OR ""liberal OR democrats"")","This Government is leading the world in making sure that vile terrorist content is stamped out. Technology like this can heavily disrupt the terrorists' actions, prevent their poisonous propaganda and help keep people in the UK safe.  https://t.co/hIn1zMsQfN",0.32,0.482,0.198,-0.8779,09:44:40
925,963344768410505216,963344768410505216,1518514265000.0,2018-02-13,BIG SPRING BEACH CLEAN 2018! We’re targeting 2500+ beaches &amp; waterways in the UK and aiming to record and share #AvoidablePlastic evidence with the Government in a mass citizen science action! . Become a Beach Clean Leader at beachcleans@sas.org.uk #BSBC18 #AvoidablePlastics  https://t.co/6g97Bfmxli,en,"['avoidableplastic', 'bsbc18', 'avoidableplastics']",50278507,sascampaigns,Surfers Against Sewage,https://twitter.com/sascampaigns/status/963344768410505216,[],340,22,273,"UK (Labour OR Conservative OR Parliament OR Government OR ""Lib OR dems"" OR ""liberal OR democrats"")",BIG SPRING BEACH CLEAN 2018! We’re targeting 2500+ beaches &amp; waterways in the UK and aiming to record and share #AvoidablePlastic evidence with the Government in a mass citizen science action! . Become a Beach Clean Leader at beachcleans@sas.org.uk #BSBC18 #AvoidablePlastics  https://t.co/6g97Bfmxli,0.0,0.814,0.186,0.8367,09:31:05
926,963337448888598529,963337448888598529,1518512520000.0,2018-02-13,"This is not ‘Project Fear’, this is not ‘scaremongering’, this is the government’s own figures showing that the UK will be catastrophically worse off in every situation after #Brexit.  We must give the public a vote on the final deal #ExitFromBrexit  https://t.co/dQDX23wN7x",en,"['brexit', 'exitfrombrexit']",21666641,thomasbrake,Tom Brake,https://twitter.com/thomasbrake/status/963337448888598529,['http://bit.ly/2C6V5oa'],644,45,607,"UK (Labour OR Conservative OR Parliament OR Government OR ""Lib OR dems"" OR ""liberal OR democrats"")","This is not ‘Project Fear’, this is not ‘scaremongering’, this is the government’s own figures showing that the UK will be catastrophically worse off in every situation after #Brexit.  We must give the public a vote on the final deal #ExitFromBrexit  https://t.co/dQDX23wN7x",0.07,0.93,0.0,-0.4767,09:02:00
927,963327476100411393,963327476100411393,1518510142000.0,2018-02-13,"Lesson 101 on negotiations - know what you want Incredibly this Tory government after 1. Calling the referendum 2. Triggering Article 50 STILL does not know what it wants  UK is being trashed by a few quarrelling second-rate politicians History will judge the ""guilty men &amp; women""",en,[],893568606,TomLondon6,Tom London,https://twitter.com/TomLondon6/status/963327476100411393,[],366,18,250,"UK (Labour OR Conservative OR Parliament OR Government OR ""Lib OR dems"" OR ""liberal OR democrats"")","Lesson 101 on negotiations - know what you want Incredibly this Tory government after 1. Calling the referendum 2. Triggering Article 50 STILL does not know what it wants  UK is being trashed by a few quarrelling second-rate politicians History will judge the ""guilty men &amp; women""",0.057,0.916,0.026,-0.3612,08:22:22
928,963897048276918275,963897048276918275,1518645939000.0,2018-02-14,"One notable absence from Labour’s announcement today of things they’d ban on UK farms - a ban on imports using those same banned techniques. British farmers already have world beating animal welfare standards, shouldn’t we expect the rest of the world to catch up first?",en,[],130437389,essexpeasant,Guy Smith,https://twitter.com/essexpeasant/status/963897048276918275,[],201,7,83,"UK (Labour OR Conservative OR Parliament OR Government OR ""Lib OR dems"" OR ""liberal OR democrats"")","One notable absence from Labour’s announcement today of things they’d ban on UK farms - a ban on imports using those same banned techniques. British farmers already have world beating animal welfare standards, shouldn’t we expect the rest of the world to catch up first?",0.244,0.756,0.0,-0.9217,22:05:39
929,963827828834885634,963827828834885634,1518629436000.0,2018-02-14,You might not have heard of John Jappy But without him I would never have started questioning UK Government figures You broke this Unicorn's chains John You will be sorely missed  https://t.co/HF7cIQoXDf,en,[],63528313,MrMalky,Mr Malky,https://twitter.com/MrMalky/status/963827828834885634,['https://twitter.com/elle49/status/963525624877977600'],379,18,239,"UK (Labour OR Conservative OR Parliament OR Government OR ""Lib OR dems"" OR ""liberal OR democrats"")",You might not have heard of John Jappy But without him I would never have started questioning UK Government figures You broke this Unicorn's chains John You will be sorely missed  https://t.co/HF7cIQoXDf,0.176,0.785,0.039,-0.7232,17:30:36
930,963827153832902658,963827153832902658,1518629275000.0,2018-02-14,The Welsh government recognises the Welsh language  And the Scottish government recognises the Gaelic language  But the DUP does not want to recognise the Irish language  Why are the DUP so determined to be out of step with the rest of the UK of which they want to be a part?,en,[],12588712,RichardJMurphy,Richard Murphy,https://twitter.com/RichardJMurphy/status/963827153832902658,[],1407,116,722,"UK (Labour OR Conservative OR Parliament OR Government OR ""Lib OR dems"" OR ""liberal OR democrats"")",The Welsh government recognises the Welsh language  And the Scottish government recognises the Gaelic language  But the DUP does not want to recognise the Irish language  Why are the DUP so determined to be out of step with the rest of the UK of which they want to be a part?,0.024,0.873,0.102,0.6476,17:27:55
931,963819256935829504,963819256935829504,1518627392000.0,2018-02-14,"With the Stormont Talks having ended in failure, we call on UK government to legislate for #MarriageEquality without further delay.  Secretary of State - do your duty.  https://t.co/BsdaSLjjjr",en,['marriageequality'],636249988,Love_EqualityNI,Love Equality NI,https://twitter.com/Love_EqualityNI/status/963819256935829504,[],155,2,84,"UK (Labour OR Conservative OR Parliament OR Government OR ""Lib OR dems"" OR ""liberal OR democrats"")","With the Stormont Talks having ended in failure, we call on UK government to legislate for #MarriageEquality without further delay.  Secretary of State - do your duty.  https://t.co/BsdaSLjjjr",0.106,0.832,0.063,-0.3265,16:56:32
932,963814321418571776,963814321418571776,1518626215000.0,2018-02-14,Boris Johnson said most ppl don't know their MEPs name nor understand what EU does. True - 75% of Brits also don't know who their MP is and have little understanding of how UK government works. Should we all leave the British Isles and go and live on Rockall @BorisJohnson  https://t.co/MUdkSllZfT,en,[],310746442,Otto_English,Otto English,https://twitter.com/Otto_English/status/963814321418571776,[],222,24,118,"UK (Labour OR Conservative OR Parliament OR Government OR ""Lib OR dems"" OR ""liberal OR democrats"")",Boris Johnson said most ppl don't know their MEPs name nor understand what EU does. True - 75% of Brits also don't know who their MP is and have little understanding of how UK government works. Should we all leave the British Isles and go and live on Rockall @BorisJohnson  https://t.co/MUdkSllZfT,0.023,0.925,0.053,0.3818,16:36:55
933,963769656350789632,963769656350789632,1518615566000.0,2018-02-14,"UK government announcing a crackdown on unauthorized slaughterhouses (nicknamed ""steakeasies"") which have sprung up to avoid meat rationing.",en,[],364488011,RealTimeWWII,Second World War tweets from 1945,https://twitter.com/RealTimeWWII/status/963769656350789632,[],228,8,72,"UK (Labour OR Conservative OR Parliament OR Government OR ""Lib OR dems"" OR ""liberal OR democrats"")","UK government announcing a crackdown on unauthorized slaughterhouses (nicknamed ""steakeasies"") which have sprung up to avoid meat rationing.",0.115,0.885,0.0,-0.296,13:39:26
934,963727821293178880,963727821293178880,1518605592000.0,2018-02-14,Bold action from other countries to cut air pollution really does highlight just how feeble the UK government is on this issue:  https://t.co/bXOtIWCb1w,en,[],80802900,CarolineLucas,Caroline Lucas,https://twitter.com/CarolineLucas/status/963727821293178880,['https://www.theguardian.com/world/2018/feb/14/german-cities-to-trial-free-public-transport-to-cut-pollution'],482,29,276,"UK (Labour OR Conservative OR Parliament OR Government OR ""Lib OR dems"" OR ""liberal OR democrats"")",Bold action from other countries to cut air pollution really does highlight just how feeble the UK government is on this issue:  https://t.co/bXOtIWCb1w,0.15,0.665,0.185,0.2449,10:53:12
935,963708871796719616,963708871796719616,1518601074000.0,2018-02-14,"Today, Labour has launched our proposals to make the UK a world leader on animal welfare.  No animal should be treated cruelly or made to suffer unnecessary pain.    https://t.co/8IvolJ6Kb9",en,[],117777690,jeremycorbyn,Jeremy Corbyn,https://twitter.com/jeremycorbyn/status/963708871796719616,['https://labour.org.uk/animalwelfare'],4512,632,1740,"UK (Labour OR Conservative OR Parliament OR Government OR ""Lib OR dems"" OR ""liberal OR democrats"")","Today, Labour has launched our proposals to make the UK a world leader on animal welfare.  No animal should be treated cruelly or made to suffer unnecessary pain.    https://t.co/8IvolJ6Kb9",0.334,0.627,0.039,-0.9062,09:37:54
936,963697640704827392,963697640704827392,1518598396000.0,2018-02-14,Will somebody ask @BorisJohnson today why he’s still refusing to publish his own Government’s economic analysis illustrating the harm his version of #Brexit could do to livelihoods across the UK? Perhaps because he’s worried the public might change their minds? #FactsMatter,en,"['brexit', 'factsmatter']",354911386,ChrisLeslieUK,Chris Leslie,https://twitter.com/ChrisLeslieUK/status/963697640704827392,[],433,23,251,"UK (Labour OR Conservative OR Parliament OR Government OR ""Lib OR dems"" OR ""liberal OR democrats"")",Will somebody ask @BorisJohnson today why he’s still refusing to publish his own Government’s economic analysis illustrating the harm his version of #Brexit could do to livelihoods across the UK? Perhaps because he’s worried the public might change their minds? #FactsMatter,0.184,0.776,0.04,-0.782,08:53:16
937,963691836710817794,963691836710817794,1518597013000.0,2018-02-14,What a disingenuous pile of nonsense! Labour runs Midlothian Council with the help of 3rd largest party......the Tories  For British Nationalists like Jeremy the main concern is maintaining UK &amp; helping a Hard Brexit  Neither are in Scotland’s interests  https://t.co/JNZ6w26UZv,en,[],2174269755,mstewart_23,Michael Stewart,https://twitter.com/mstewart_23/status/963691836710817794,['https://twitter.com/jeremycorbyn/status/963468853719261185'],858,40,429,"UK (Labour OR Conservative OR Parliament OR Government OR ""Lib OR dems"" OR ""liberal OR democrats"")",What a disingenuous pile of nonsense! Labour runs Midlothian Council with the help of 3rd largest party......the Tories  For British Nationalists like Jeremy the main concern is maintaining UK &amp; helping a Hard Brexit  Neither are in Scotland’s interests  https://t.co/JNZ6w26UZv,0.086,0.711,0.203,0.68,08:30:13
938,963685375125413889,963685375125413889,1518595472000.0,2018-02-14,Cameron tried to block Mogg becoming an MP for being posh!  Working class people across the UK like Mogg because of his authenticity.   The Conservative party is a broad church &amp; it’s absolutely right to embrace fabulous eccentrics like Mogg!  #BeMoreMogg   https://t.co/9KbDQlf35K,en,['bemoremogg'],886581135156948992,BeccyRyan,Rebecca Ryan,https://twitter.com/BeccyRyan/status/963685375125413889,['https://www.thesun.co.uk/news/5572248/david-cameron-stop-jacob-rees-mogg-becoming-an-mp/'],275,47,138,"UK (Labour OR Conservative OR Parliament OR Government OR ""Lib OR dems"" OR ""liberal OR democrats"")",Cameron tried to block Mogg becoming an MP for being posh!  Working class people across the UK like Mogg because of his authenticity.   The Conservative party is a broad church &amp; it’s absolutely right to embrace fabulous eccentrics like Mogg!  #BeMoreMogg   https://t.co/9KbDQlf35K,0.055,0.677,0.268,0.8846,08:04:32
939,964634430886350848,964634430886350848,1518821745000.0,2018-02-16,There are two things about UK politics that I think should be adopted in the United States. 1. Prime Minister’s Questions 2. Cats for various arms of government  https://t.co/Bz0dwqK5yZ,en,[],2167286587,byrdinator,Haley Byrd Wilt 🌻,https://twitter.com/byrdinator/status/964634430886350848,['https://twitter.com/nickdixonitv/status/964402804931534848'],323,19,64,"UK (Labour OR Conservative OR Parliament OR Government OR ""Lib OR dems"" OR ""liberal OR democrats"")",There are two things about UK politics that I think should be adopted in the United States. 1. Prime Minister’s Questions 2. Cats for various arms of government  https://t.co/Bz0dwqK5yZ,0.0,0.909,0.091,0.4215,22:55:45
940,964626190773473280,964626190773473280,1518819780000.0,2018-02-16,"Dear EU 27 residents in the UK, you have the right to vote in the May 3 Local Council Elections. If you feel you've been treated unjustly please use that right and make the Tories and Labour hear your voices! #StopBrexit #Brexit #FBPE #ABTV",en,"['stopbrexit', 'brexit', 'fbpe', 'abtv']",746371177174679552,nickreeves9876,Nick Reeves #StandWithUkraine #FBRejoinEU #PATH,https://twitter.com/nickreeves9876/status/964626190773473280,[],253,7,250,"UK (Labour OR Conservative OR Parliament OR Government OR ""Lib OR dems"" OR ""liberal OR democrats"")","Dear EU 27 residents in the UK, you have the right to vote in the May 3 Local Council Elections. If you feel you've been treated unjustly please use that right and make the Tories and Labour hear your voices! #StopBrexit #Brexit #FBPE #ABTV",0.0,0.89,0.11,0.636,22:23:00
941,964585782660009986,964585782660009986,1518810146000.0,2018-02-16,"Meanwhile here in the UK our Government is doing precisely nothing, leaving it to @ElectoralCommUK &amp; Select Committees with very limited powers   https://t.co/8unVpHXqJQ",en,[],24211594,BenPBradshaw,Ben Bradshaw,https://twitter.com/BenPBradshaw/status/964585782660009986,['http://www.bbc.com/news/world-us-canada-43092085'],396,27,314,"UK (Labour OR Conservative OR Parliament OR Government OR ""Lib OR dems"" OR ""liberal OR democrats"")","Meanwhile here in the UK our Government is doing precisely nothing, leaving it to @ElectoralCommUK &amp; Select Committees with very limited powers   https://t.co/8unVpHXqJQ",0.091,0.909,0.0,-0.2944,19:42:26
942,964577907900370946,964577907900370946,1518808268000.0,2018-02-16,"The UK government should not be giving any money to charities, they are charities, and the British people should decide whether to hand them money or not. Taxpayers should not be compelled to fund these organisations.  In the case of Oxfam, the people will decide what to do.",en,[],555370896,Rob_Kimbell,Robert Kimbell,https://twitter.com/Rob_Kimbell/status/964577907900370946,[],345,25,195,"UK (Labour OR Conservative OR Parliament OR Government OR ""Lib OR dems"" OR ""liberal OR democrats"")","The UK government should not be giving any money to charities, they are charities, and the British people should decide whether to hand them money or not. Taxpayers should not be compelled to fund these organisations.  In the case of Oxfam, the people will decide what to do.",0.057,0.771,0.172,0.8134,19:11:08
943,964561403070828544,964561403070828544,1518804333000.0,2018-02-16,".@PennyMordaunt: “Following our discussions, Oxfam has agreed to withdraw from bidding for any new UK Government funding until DFID is satisfied that they can meet the high standards we expect of our partners”  https://t.co/H21kaR7eeg  https://t.co/ttPvP8PReo",en,[],19915362,DFID_UK,DFID,https://twitter.com/DFID_UK/status/964561403070828544,['http://www.gov.uk/government/news/statement-from-the-international-development-secretary-on-oxfam'],161,27,127,"UK (Labour OR Conservative OR Parliament OR Government OR ""Lib OR dems"" OR ""liberal OR democrats"")",".@PennyMordaunt: “Following our discussions, Oxfam has agreed to withdraw from bidding for any new UK Government funding until DFID is satisfied that they can meet the high standards we expect of our partners”  https://t.co/H21kaR7eeg  https://t.co/ttPvP8PReo",0.0,0.871,0.129,0.5994,18:05:33
944,964444156704776192,964444156704776192,1518776380000.0,2018-02-16,Next Tuesday I've been invited to give a lecture at Speaker’s House in Parliament on the opportunities Brexit affords the UK. My vision will include discussing how to spend the money we save from our contributions which will boost both our growth rate &amp; our balance of payments.,en,[],93880122,johnredwood,John Redwood,https://twitter.com/johnredwood/status/964444156704776192,[],458,84,192,"UK (Labour OR Conservative OR Parliament OR Government OR ""Lib OR dems"" OR ""liberal OR democrats"")",Next Tuesday I've been invited to give a lecture at Speaker’s House in Parliament on the opportunities Brexit affords the UK. My vision will include discussing how to spend the money we save from our contributions which will boost both our growth rate &amp; our balance of payments.,0.0,0.766,0.234,0.9022,10:19:40
945,964417457979932672,963978544295505922,1518770014000.0,2018-02-16,"@frankenskank @Okoli007 @TomiLahren I'm from London, UK. We've never had one here. We haven't had one in the UK since Dunblane when 16 5 &amp; 6 year old and their teacher were killed in 3-4 minutes. Our government then enacted tighter gun control laws, banned all handguns &amp; there hasn't been one since #FloridaShooting",en,['floridashooting'],336017313,FightMonsters,Charlie Motton,https://twitter.com/FightMonsters/status/964417457979932672,[],392,9,23,"UK (Labour OR Conservative OR Parliament OR Government OR ""Lib OR dems"" OR ""liberal OR democrats"")","@frankenskank @Okoli007 @TomiLahren I'm from London, UK. We've never had one here. We haven't had one in the UK since Dunblane when 16 5 &amp; 6 year old and their teacher were killed in 3-4 minutes. Our government then enacted tighter gun control laws, banned all handguns &amp; there hasn't been one since #FloridaShooting",0.163,0.837,0.0,-0.872,08:33:34
946,964402011419496448,964402011419496448,1518766331000.0,2018-02-16,"'New Dawn' (2015) light sculpture by Mary Branson, Westminster Hall, Parliament, UK, commissioned to honor women's suffrage #womensart  https://t.co/EaJdCP0HUs",en,['womensart'],4823705386,womensart1,#WOMENSART,https://twitter.com/womensart1/status/964402011419496448,[],326,0,135,"UK (Labour OR Conservative OR Parliament OR Government OR ""Lib OR dems"" OR ""liberal OR democrats"")","'New Dawn' (2015) light sculpture by Mary Branson, Westminster Hall, Parliament, UK, commissioned to honor women's suffrage #womensart  https://t.co/EaJdCP0HUs",0.0,0.849,0.151,0.4939,07:32:11
